{
  "format": "unfold-board",
  "pages": [
    {
      "cards": [
        {
          "at": [
            -104,
            1221
          ],
          "description": {
            "author": "agent:codex",
            "signature": "sha256:6f2bbed7bc305377d2f6121f38f0a9c68aec9409b5f6a533bcc25bcc609197ba",
            "text": "The Prefer header chooses queued placement (202) or synchronous placement (201). The queued path returns before the synchronous calls."
          },
          "id": "create-order",
          "open": [
            [
              "src/routes/orders.ts#createOrder/call:orderService.place"
            ]
          ],
          "ref": {
            "block": "src/routes/orders.ts#createOrder"
          }
        },
        {
          "at": [
            -104,
            -2
          ],
          "id": "middleware-0",
          "ref": {
            "block": "src/routes/middleware.ts#requireUser"
          }
        },
        {
          "at": [
            -104,
            535
          ],
          "id": "middleware-1",
          "ref": {
            "block": "src/routes/middleware.ts#validateBody"
          }
        },
        {
          "at": [
            674,
            1563
          ],
          "description": {
            "author": "agent:codex",
            "signature": "sha256:74d246fe8920d24dde56b962e36f4001a96d57f1b0583692916edb20b422afe9",
            "text": "Validates the draft, charges through the injected payment provider, builds and inserts the order, emits order.placed, and returns it."
          },
          "id": "place-order",
          "ref": {
            "block": "src/services/order-service.ts#OrderService.place"
          }
        },
        {
          "at": [
            -404,
            -2
          ],
          "description": {
            "author": "agent:codex",
            "signature": "sha256:34a3e259a72bc13c4877bd535af6a149458bc9116b12134a5fba3323d9f7b10f",
            "text": "The POST route runs requireUser, validateBody, and createOrder in this order. Registering a handler doesn't guarantee a middleware calls next()."
          },
          "id": "post-orders",
          "ref": {
            "entrance": "entrance:server/place-an-order"
          },
          "view": "compact"
        },
        {
          "at": [
            1222,
            722
          ],
          "id": "validate-order",
          "ref": {
            "block": "src/lib/validate.ts#validateOrder"
          }
        }
      ],
      "combined": [
        {
          "author": "agent:codex",
          "collapsed": false,
          "description": {
            "author": "agent:codex",
            "signature": "sha256:eba575631a1b2cb75725933e26c3feec5c5cf9eb10dab0be0f7168b43d35dbc5",
            "text": "Queue the draft and acknowledge the job without continuing into the synchronous path."
          },
          "id": "async-placement",
          "members": [
            "src/routes/orders.ts#createOrder/if[0]"
          ],
          "signature": "sha256:eba575631a1b2cb75725933e26c3feec5c5cf9eb10dab0be0f7168b43d35dbc5",
          "title": "Queue async placement"
        },
        {
          "author": "agent:codex",
          "collapsed": true,
          "id": "build-order",
          "members": [
            "src/services/order-service.ts#OrderService.place/call:randomUUID",
            "src/services/order-service.ts#OrderService.place/call:(…).toISOString"
          ],
          "signature": "sha256:97014cebc63529d3325002b07d854c379585a06e46e8c0b28a111f46de77fc5d",
          "title": "Build the order with an ID and a timestamp"
        },
        {
          "author": "agent:codex",
          "collapsed": true,
          "description": {
            "author": "agent:codex",
            "signature": "sha256:97e866882db48cd0b98497daf8908aaa14e21295016f46217b8044b1d4ef23ff",
            "text": "Place the order, post a Slack notification, and return the created order."
          },
          "id": "sync-placement",
          "members": [
            "src/routes/orders.ts#createOrder/call:orderService.place",
            "src/routes/orders.ts#createOrder/call:slack.post",
            "src/routes/orders.ts#createOrder/call:res.status().json"
          ],
          "signature": "sha256:97e866882db48cd0b98497daf8908aaa14e21295016f46217b8044b1d4ef23ff",
          "title": "Place and acknowledge"
        }
      ],
      "defaultView": "expanded",
      "guards": [
        {
          "key": "entrance:server/place-an-order",
          "kind": "entrance",
          "owner": "",
          "signature": "sha256:fd5704e2f9059ae3d22b6b3ee1f71101000f71750159183d92ef06b883bb105c"
        },
        {
          "key": "src/lib/validate.ts#validateOrder",
          "kind": "function",
          "owner": "src/lib/validate.ts#",
          "signature": "sha256:14d08db85918ec99ac0df5609760cde0516de5854753deac20b821af114883f7"
        },
        {
          "key": "src/lib/validate.ts#validateOrder/call:items.map",
          "kind": "call",
          "owner": "src/lib/validate.ts#validateOrder",
          "signature": "sha256:d17314946ec4ec5e4ec6711d04d7bca7b2e64f7e32b5e39d9ed455068213aab4"
        },
        {
          "key": "src/lib/validate.ts#validateOrder/if[0]",
          "kind": "decision",
          "owner": "src/lib/validate.ts#validateOrder",
          "signature": "sha256:613cda99b549185031d06c7c616fbe877570968e01340f8ecfe7e14692487e76"
        },
        {
          "key": "src/lib/validate.ts#validateOrder/if[1]",
          "kind": "decision",
          "owner": "src/lib/validate.ts#validateOrder",
          "signature": "sha256:cc603340b13d717065ed54caf6240a2e0972e5ff63a8e0d678b587ef79c6d87a"
        },
        {
          "key": "src/lib/validate.ts#validateOrder/return[0]",
          "kind": "exit",
          "owner": "src/lib/validate.ts#validateOrder",
          "signature": "sha256:780602c7d14c920493617cde5a3bcc7e7b7151bec357a3053292992ead8c1017"
        },
        {
          "key": "src/routes/middleware.ts#requireUser",
          "kind": "function",
          "owner": "src/routes/middleware.ts#",
          "signature": "sha256:fa67e7ca5cfd80f1631c832985f3e469f1b2d7700a0a79d9f64a76a18c64390d"
        },
        {
          "key": "src/routes/middleware.ts#requireUser/call:next",
          "kind": "call",
          "owner": "src/routes/middleware.ts#requireUser",
          "signature": "sha256:faa91ee90040b086114a362567489d782d302e909e076dee38bead948a5a59ca"
        },
        {
          "key": "src/routes/middleware.ts#requireUser/if[0]",
          "kind": "decision",
          "owner": "src/routes/middleware.ts#requireUser",
          "signature": "sha256:d63f3021fe7566b3e3c1ec688f022b82babf71a6e4024b77a9581d28cdc7c8a6"
        },
        {
          "key": "src/routes/middleware.ts#requireUser/if[0]/then/call:res.status().json",
          "kind": "call",
          "owner": "src/routes/middleware.ts#requireUser",
          "signature": "sha256:df55c2696dc38610fb0172663cfe99ff97aaacd5d301ed312b5ec4d6df5435f5"
        },
        {
          "key": "src/routes/middleware.ts#validateBody",
          "kind": "function",
          "owner": "src/routes/middleware.ts#",
          "signature": "sha256:8666f553b1a5f1c60b18b2acc7c31d50f2637313a52c2aca6730f2cad3563bc6"
        },
        {
          "key": "src/routes/middleware.ts#validateBody/call:next",
          "kind": "call",
          "owner": "src/routes/middleware.ts#validateBody",
          "signature": "sha256:faa91ee90040b086114a362567489d782d302e909e076dee38bead948a5a59ca"
        },
        {
          "key": "src/routes/middleware.ts#validateBody/try[0]/body/call:validateOrder",
          "kind": "call",
          "owner": "src/routes/middleware.ts#validateBody",
          "signature": "sha256:ee38ee3d5baf4761a2453ca19f756b1262c6c095c505e6a383c4dc9a62f1cdcc"
        },
        {
          "key": "src/routes/middleware.ts#validateBody/try[0]/catch",
          "kind": "part",
          "owner": "src/routes/middleware.ts#validateBody",
          "signature": "sha256:b4ad460544ef3f213041fda7045b20a3d32d4c0c4b22a5d6864470a4e2cefeca"
        },
        {
          "key": "src/routes/middleware.ts#validateBody/try[0]/catch/call:res.status().json",
          "kind": "call",
          "owner": "src/routes/middleware.ts#validateBody",
          "signature": "sha256:415ae11054b9a56666325c7bcc12380ed4461d35f5d0a10c6ce0d7972a0d64a3"
        },
        {
          "key": "src/routes/orders.ts#createOrder",
          "kind": "function",
          "owner": "src/routes/orders.ts#",
          "signature": "sha256:6f2bbed7bc305377d2f6121f38f0a9c68aec9409b5f6a533bcc25bcc609197ba"
        },
        {
          "key": "src/routes/orders.ts#createOrder/call:orderService.place",
          "kind": "call",
          "owner": "src/routes/orders.ts#createOrder",
          "signature": "sha256:2f032e7ddac743783617004f534f8b2a7b922fc7fd631cfe9e79f8d9b9068782"
        },
        {
          "key": "src/routes/orders.ts#createOrder/call:res.status().json",
          "kind": "call",
          "owner": "src/routes/orders.ts#createOrder",
          "signature": "sha256:c26b1fd72b0185c1e2071031e3bd126c853c613845d1a8f16d24b8890c88daaa"
        },
        {
          "key": "src/routes/orders.ts#createOrder/call:slack.post",
          "kind": "call",
          "owner": "src/routes/orders.ts#createOrder",
          "signature": "sha256:ffa2f0c954f16346429b87eb07f3454eac34790f01b8a0b05ac2c7c82f2a2945"
        },
        {
          "key": "src/routes/orders.ts#createOrder/if[0]",
          "kind": "decision",
          "owner": "src/routes/orders.ts#createOrder",
          "signature": "sha256:eba575631a1b2cb75725933e26c3feec5c5cf9eb10dab0be0f7168b43d35dbc5"
        },
        {
          "key": "src/routes/orders.ts#createOrder/if[0]/then/call:ordersQueue.add",
          "kind": "call",
          "owner": "src/routes/orders.ts#createOrder",